{
  "$schema": "https://artyx.ai/schemas/marketplace/1.json",
  "name": "artyx-official",
  "interface": {
    "displayName": "Artyx official"
  },
  "plugins": [
    {
      "name": "blender",
      "source": { "source": "local", "path": "./plugins/blender" },
      "policy": { "installation": "AVAILABLE", "authentication": "ON_INSTALL" }
    },
    {
      "name": "unity",
      "source": { "source": "local", "path": "./plugins/unity" },
      "policy": { "installation": "AVAILABLE", "authentication": "ON_INSTALL" }
    },
    {
      "name": "unreal-engine",
      "source": { "source": "local", "path": "./plugins/unreal-engine" },
      "policy": { "installation": "AVAILABLE", "authentication": "ON_INSTALL" }
    },
    {
      "name": "godot",
      "source": { "source": "local", "path": "./plugins/godot" },
      "policy": { "installation": "AVAILABLE", "authentication": "ON_INSTALL" }
    },
    {
      "name": "game-ready-assets",
      "source": { "source": "local", "path": "./plugins/game-ready-assets" },
      "policy": { "installation": "AVAILABLE", "authentication": "ON_INSTALL" }
    },
    {
      "name": "gta-v",
      "source": { "source": "local", "path": "./plugins/gta-v" },
      "policy": { "installation": "AVAILABLE", "authentication": "ON_INSTALL" }
    },
    {
      "name": "goldsrc",
      "source": { "source": "local", "path": "./plugins/goldsrc" },
      "policy": { "installation": "AVAILABLE", "authentication": "ON_INSTALL" }
    }
  ],
  "agents": [
    {
      "name": "csgo-weapon-builder-expert",
      "source": { "source": "local", "path": "./agents/csgo-weapon-builder-expert" },
      "category": "Gaming"
    }
  ]
}
